{
  "schemaVersion": 1,
  "kind": "ArtifactBuilt",
  "recordedAt": "2026-10-28T19:05:22Z",
  "source": {
    "type": "github-actions",
    "workflow": "build / cssc-dashboard",
    "runUrl": "https://github.com/toddysm/cssc-framework/actions/runs/40750502702",
    "runId": "40750502702",
    "runAttempt": "1"
  },
  "image": {
    "registry": "ghcr.io",
    "repository": "toddysm/apps/cssc-dashboard/packages-service",
    "digest": "sha256:272f8f7e2a4526eb6c94ec8536808c80f01e4c742e5591e493b1477aa8f3c994"
  },
  "base": {
    "name": "ghcr.io/toddysm/golden/python",
    "digest": "sha256:cae66f2ef0ec51a9891263eeee7f987dacf0a9879e8aa9353d5606e0530619a5",
    "tag": "3.14-slim"
  },
  "buildVersion": "0.1.2-1415ccd",
  "sourceCommit": "1415ccdf57ba560728c7820fb3a3258d1156f56e",
  "id": "sha256:756227bc6541b6a610b40977cfa19f6e39f9b597864f03048580dbbadcc85647"
}
