{
  "schemaVersion": 1,
  "kind": "ArtifactBuilt",
  "recordedAt": "2026-08-14T03:07:14Z",
  "source": {
    "type": "github-actions",
    "workflow": "build / cssc-dashboard",
    "runUrl": "https://github.com/toddysm/cssc-framework/actions/runs/31765657652",
    "runId": "31765657652",
    "runAttempt": "1"
  },
  "image": {
    "registry": "ghcr.io",
    "repository": "toddysm/apps/cssc-dashboard/packages-service",
    "digest": "sha256:a10a2b51f0e21b4f7078d7f82a6ea7371c3d33a433355c06d43e8b0f3c36595f"
  },
  "base": {
    "name": "ghcr.io/toddysm/golden/python",
    "digest": "sha256:a7fb1e634c4a578f9e0bd6327f11a3cde11b7a9395f48e24360c0988bcc5c2bc",
    "tag": "3.14-slim"
  },
  "buildVersion": "0.1.2-63ba290",
  "sourceCommit": "63ba29048270a90446cf6c9632a3d0f9b9c92298",
  "id": "sha256:4aba313a1793eb71930924086a889f0facfa4652dc31e76dc07dc40a9704675a"
}
