{
  "schemaVersion": 1,
  "kind": "ArtifactBuilt",
  "recordedAt": "2026-08-29T04:13:31Z",
  "source": {
    "type": "github-actions",
    "workflow": "build / cssc-dashboard",
    "runUrl": "https://github.com/toddysm/cssc-framework/actions/runs/33233121192",
    "runId": "33233121192",
    "runAttempt": "1"
  },
  "image": {
    "registry": "ghcr.io",
    "repository": "toddysm/apps/cssc-dashboard/graph-service",
    "digest": "sha256:2288940a66d5fab3c4d2b531313a0ace59bfcfc615f27ae1ece1681cb26a2c83"
  },
  "base": {
    "name": "ghcr.io/toddysm/golden/python",
    "digest": "sha256:cae66f2ef0ec51a9891263eeee7f987dacf0a9879e8aa9353d5606e0530619a5",
    "tag": "3.14-slim"
  },
  "buildVersion": "0.1.2-97a4ea9",
  "sourceCommit": "97a4ea97b520afa4b81818acc37e8043819a4a1e",
  "id": "sha256:69e6bdd40f4bbf86c37d0bd08dc8f652441910df1ea4a58711bdd99fdb76f635"
}
